[
  {
    "id": "DEC-001",
    "category": "DECISION",
    "status": "PENDING",
    "severity": "NA",
    "owner": "Michael Maillet",
    "summary": "Use AxiomLint from current attached plan as provisional name",
    "requirements": [],
    "evidence": [],
    "disposition": "Await maintainer decision or later package evidence",
    "blocking_gate": "G0",
    "approval_ref": ""
  },
  {
    "id": "DEC-002",
    "category": "DECISION",
    "status": "APPROVED",
    "severity": "NA",
    "owner": "Michael Maillet",
    "summary": "Principal ratified AMD-001 local-only acceptance; package-specific evidence and independent review still required",
    "requirements": [],
    "evidence": [
      "governance/charter/AMD-001-local-only.md",
      "governance/approvals/APR-001-constitutional-ratification.json"
    ],
    "disposition": "Actual principal ratification recorded in APR-001; not a passed package gate or unqualified upstream compliance claim",
    "blocking_gate": "G0",
    "approval_ref": "governance/approvals/APR-001-constitutional-ratification.md"
  },
  {
    "id": "DEC-003",
    "category": "DECISION",
    "status": "PENDING",
    "severity": "NA",
    "owner": "Michael Maillet",
    "summary": "Keep zero-dependency foundation and disabled subject execution",
    "requirements": [],
    "evidence": [],
    "disposition": "Await maintainer decision or later package evidence",
    "blocking_gate": "G0",
    "approval_ref": ""
  },
  {
    "id": "DEC-004",
    "category": "DECISION",
    "status": "APPROVED",
    "severity": "NA",
    "owner": "Michael Maillet",
    "summary": "User explicitly granted conditional decision delegation within existing governance; not charter ratification",
    "requirements": ["REQ-GOV-003"],
    "evidence": [
      "governance/decisions/DEC-004-delegated-authority.md",
      "governance/decisions/delegated-authority.json"
    ],
    "disposition": "Original conditional grant remains historical and is not itself ratification; subsequent actual APR-001 separately ratifies AMD-002",
    "blocking_gate": "G0",
    "approval_ref": "governance/decisions/DEC-004-delegated-authority.md"
  },
  {
    "id": "DEC-005",
    "category": "DECISION",
    "status": "APPROVED",
    "severity": "NA",
    "owner": "Michael Maillet",
    "summary": "Actual principal ratification of the exact charter, AMD-001 and AMD-002; prospective activation only",
    "requirements": ["REQ-GOV-003", "REQ-LOCAL-001"],
    "evidence": [
      "governance/approvals/APR-001-constitutional-ratification.json",
      "governance/charter/ACTIVE-BASELINE.json",
      "governance/decisions/authority-map.md"
    ],
    "disposition": "Constitutional authority activated; no historical session, finding, risk, benchmark or package retroactively accepted",
    "blocking_gate": "G0",
    "approval_ref": "governance/approvals/APR-001-constitutional-ratification.md"
  },
  {
    "id": "DEC-006",
    "category": "DECISION",
    "status": "APPROVED",
    "severity": "NA",
    "owner": "Independent readiness reviewer context independent_wp_001_s1_readiness_decision_mvheckh1",
    "summary": "Actual separate-context ordinary S1 exit approval for implementation commit 846b0dcbae94b0eb268fe10571c395c90a4f1228, subject to bounded recording and independent later-head verification",
    "requirements": ["REQ-GOV-001", "REQ-GOV-003"],
    "evidence": [
      "governance/readiness/WP-001/round-3/review.md",
      "governance/readiness/WP-001/round-3/decision.json",
      "governance/readiness/WP-001/round-3/transition-probe.py",
      "governance/execution/WP-001/S1/exit.json",
      "governance/execution/WP-001/S1/exit.md"
    ],
    "disposition": "Records unchanged actual reviewer decision SHA256 364665f10a5202f5225550312e72eabe3bb935869287b2a8ce6d690c34d78338 under ratified AMD-002; does not create or widen authority. READINESS-WP001-001 independently verified. Actual later metadata head requires independent checks before transition completion/S2 entry. No S2 execution, package/G0 closure, inherited deviation/finding waiver or material-risk acceptance",
    "blocking_gate": "S1_EXIT",
    "approval_ref": "governance/readiness/WP-001/round-3/decision.json"
  }
]
