[
  {
    "id": "FIND-S1-001",
    "category": "FINDING",
    "status": "PENDING",
    "severity": "D3",
    "owner": "Michael Maillet",
    "summary": "S1 self-check found umask-dependent source fingerprints across byte-identical fresh checkouts",
    "requirements": ["REQ-EVID-003"],
    "evidence": ["tests/test_gate.py", "governance/sessions/WP-001-S1.md"],
    "disposition": "Fixed in fe3be9da8f7b8ada431b4656ea8e9e1b7ab055c4; regression and local clone passed; independent S2 verification still pending",
    "blocking_gate": "G0",
    "approval_ref": ""
  },
  {
    "id": "READINESS-WP001-001",
    "category": "FINDING",
    "status": "VERIFIED",
    "severity": "D2",
    "owner": "Computer implementation author under APR-002",
    "summary": "Independent readiness review reproduced phase-freezing ratification and ordering fixtures that break lawful S1-exit verification",
    "requirements": ["REQ-GOV-001", "REQ-GOV-003"],
    "evidence": [
      "governance/readiness/WP-001/round-1/review.md",
      "governance/readiness/WP-001/round-1/decision.json",
      "governance/readiness/WP-001/round-1/transition-probe.py",
      "governance/readiness/WP-001/round-3/review.md",
      "governance/readiness/WP-001/round-3/decision.json",
      "governance/readiness/WP-001/round-3/transition-probe.py",
      "tests/test_wp_001_ratification.py",
      "tests/test_governance.py"
    ],
    "disposition": "Independently VERIFIED by the actual separate reviewer at implementation commit 846b0dcbae94b0eb268fe10571c395c90a4f1228: 61 targeted and 199 full-suite tests, raw evidence verification and bounded next-state probe passed. Original BLOCK and access-block records retained. This resolves only the readiness-transition defect; no waiver, inherited finding disposition or S2 claimed",
    "blocking_gate": "S1_EXIT",
    "approval_ref": "governance/readiness/WP-001/round-3/decision.json"
  }
]
