[
  {
    "id": "DEFER-001",
    "category": "DEFERRED_VALIDATION",
    "status": "DEFERRED",
    "severity": "D2",
    "owner": "Michael Maillet",
    "summary": "Full Draft 2020-12 engine and runtime schemas; owner package WP-005",
    "requirements": [],
    "evidence": [],
    "disposition": "Await maintainer decision or later package evidence",
    "blocking_gate": "G1",
    "approval_ref": ""
  },
  {
    "id": "DEFER-002",
    "category": "DEFERRED_VALIDATION",
    "status": "DEFERRED",
    "severity": "D2",
    "owner": "Michael Maillet",
    "summary": "Official locally pinned SARIF schema and reporter; owner package WP-009",
    "requirements": [],
    "evidence": [],
    "disposition": "Await maintainer decision or later package evidence",
    "blocking_gate": "G2",
    "approval_ref": ""
  },
  {
    "id": "DEFER-003",
    "category": "DEFERRED_VALIDATION",
    "status": "DEFERRED",
    "severity": "D2",
    "owner": "Michael Maillet",
    "summary": "Ruff/mypy/pytest/coverage with locked tools; owner package WP-004",
    "requirements": [],
    "evidence": [],
    "disposition": "Await maintainer decision or later package evidence",
    "blocking_gate": "G1",
    "approval_ref": ""
  },
  {
    "id": "DEFER-004",
    "category": "DEFERRED_VALIDATION",
    "status": "DEFERRED",
    "severity": "D2",
    "owner": "Michael Maillet",
    "summary": "Nix flake/lock and rootless OCI pinned image; owner package WP-004",
    "requirements": [],
    "evidence": [],
    "disposition": "Await maintainer decision or later package evidence",
    "blocking_gate": "G1",
    "approval_ref": ""
  },
  {
    "id": "DEFER-005",
    "category": "DEFERRED_VALIDATION",
    "status": "DEFERRED",
    "severity": "D2",
    "owner": "Michael Maillet",
    "summary": "Independent clean-environment reproduction remains deferred; author fresh local clone passed fe3be9d; owner package WP-004",
    "requirements": [],
    "evidence": ["governance/evidence/s1-author-verification/runs/20261020T165931Z-1d88bcbe7f93/manifest.json"],
    "disposition": "Author local replay recorded; independent review, locked environment and full WP-004 criteria still required",
    "blocking_gate": "G1",
    "approval_ref": ""
  },
  {
    "id": "DEFER-006",
    "category": "DEFERRED_VALIDATION",
    "status": "DEFERRED",
    "severity": "D2",
    "owner": "Michael Maillet",
    "summary": "Windows supported-platform verification; owner package WP-004",
    "requirements": [],
    "evidence": [],
    "disposition": "Await maintainer decision or later package evidence",
    "blocking_gate": "G1",
    "approval_ref": ""
  },
  {
    "id": "DEFER-007",
    "category": "DEFERRED_VALIDATION",
    "status": "DEFERRED",
    "severity": "D2",
    "owner": "Michael Maillet",
    "summary": "Sandbox enforcement, escape and resource-limit probes; owner package WP-006",
    "requirements": [],
    "evidence": [],
    "disposition": "Await maintainer decision or later package evidence",
    "blocking_gate": "G1",
    "approval_ref": ""
  },
  {
    "id": "DEFER-008",
    "category": "DEFERRED_VALIDATION",
    "status": "DEFERRED",
    "severity": "D2",
    "owner": "Michael Maillet",
    "summary": "Solver/CAS/Lean runtime and conformance; owner package WP-013 through WP-022",
    "requirements": [],
    "evidence": [],
    "disposition": "Await maintainer decision or later package evidence",
    "blocking_gate": "G4",
    "approval_ref": ""
  },
  {
    "id": "DEFER-009",
    "category": "DEFERRED_VALIDATION",
    "status": "DEFERRED",
    "severity": "D2",
    "owner": "Michael Maillet",
    "summary": "SCA/SBOM/secret scans, provenance and signatures; owner package WP-034",
    "requirements": [],
    "evidence": [],
    "disposition": "Await maintainer decision or later package evidence",
    "blocking_gate": "G8",
    "approval_ref": ""
  },
  {
    "id": "DEFER-010",
    "category": "DEFERRED_VALIDATION",
    "status": "DEFERRED",
    "severity": "D2",
    "owner": "Michael Maillet",
    "summary": "Package build/install and locked build backend; owner package WP-004",
    "requirements": [],
    "evidence": [],
    "disposition": "Await maintainer decision or later package evidence",
    "blocking_gate": "G1",
    "approval_ref": ""
  },
  {
    "id": "DEFER-011",
    "category": "DEFERRED_VALIDATION",
    "status": "DEFERRED",
    "severity": "D2",
    "owner": "Michael Maillet",
    "summary": "Independent S2 audit and maintainer ratification; owner package WP-001",
    "requirements": [],
    "evidence": [],
    "disposition": "Await maintainer decision or later package evidence",
    "blocking_gate": "G0",
    "approval_ref": ""
  }
]
